Title,Content
Flutter ile mobil uygulama geliştirme,"Bu makale, Flutter ile mobil uygulama geliştirmenin avantajlarını ve temel özelliklerini açıklamaktadır."
Flutter ile yeni özellikler,"Bu makale, Flutter'ın son güncellemeleri ve yeni özellikleri hakkında bilgi verir."
Dart dilinde ileri konular,"Bu makale, Dart dilinin ileri düzey konularını ve uygulama pratiklerini ele alır."
UI/UX tasarımında Flutter,"Bu makale, Flutter kullanarak etkili UI/UX tasarımı yapmanın yollarını açıklar."
En iyi uygulama pratikleri,"Bu makale, uygulama geliştirme süreçlerinde en iyi pratikler ve öneriler sunar."